name,industry,location,years_in_business,revenue,cash_flow,bestimate,website,listing_source_name,listing_source_url,source_query,recurring_revenue_signal,team_signal,retiring_owner_status,status,priority,underwriting_status,underwriting_score,research_status,research_score,last_reviewed,notes
CPA Practice - Hernando County Florida - $365K Revenue,Service Businesses,"Hernando County, FL",28,$365K,$234K,$365K,,BizBuySell,https://www.bizbuysell.com/business-opportunity/cpa-practice-hernando-county-florida-365k-revenue/2507591/,CPA practice,Strong,Moderate,Unverified,qualified,high,complete,84,pending,,2026-06-19,"Tax, bookkeeping, and payroll mix. Listing notes a solid bookkeeper expected to continue."
"Consulting, Bookkeeping and Accounting Firm",Service Businesses,"St. Charles, IL",11,$547K,$185K,$300K,,BizBuySell,https://www.bizbuysell.com/business-opportunity/consulting-bookkeeping-and-accounting-firm/2347227/,Bookkeeping,Strong,Unknown,Unverified,qualified,high,complete,81,pending,,2026-06-19,"Bookkeeping and accounting listing with disclosed cash flow and established client base."
Fairfax County Full Service CPA & Bookkeeping,Service Businesses,"Fairfax County, VA",18,$815K,$264K,$850K,,BusinessesForSale,https://us.businessesforsale.com/us/search/businesses-for-sale-in-fairfax-county,Fairfax CPA,Strong,Moderate,Unverified,qualified,high,complete,83,pending,,2026-06-19,"Founded in 2008. Full-service CPA firm with accounting, financial statements, tax planning, and bookkeeping."
Established Managed IT Services Provider with Recurring Revenue,Service Businesses,"Rapides County, LA",13,$700K,$200K,$1.6M,,BizBuySell,https://www.bizbuysell.com/business-opportunity/established-managed-it-services-provider-with-recurring-revenue/2501587/,managed IT,Strong,Moderate,Unverified,qualified,high,complete,79,pending,,2026-06-19,"Recurring managed services provider with 3 contractors and documented operations."
High Margin 24-Year Managed IT Services Provider,Service Businesses,"Davis County, UT",24,$489K,$288K,$1.5M,,BizBuySell,https://www.bizbuysell.com/business-opportunity/high-margin-24-year-managed-it-services-provider/2483775/,managed IT,Strong,Unknown,Unverified,qualified,high,complete,82,pending,,2026-06-19,"24-year operating history and solid cash flow. Recurring managed services profile."
COCoPropertyManagement,All Industries,"Terrell Hills, TX",0,$500K,$150K,$263K,,SMB.co,https://smb.co/businesses-for-sale/texas/terrell-hills,property management,Strong,Unknown,Unverified,screening,medium,complete,72,pending,,2026-06-19,"SMB.co listing surfaced from Terrell Hills source page. Revenue/cash flow/valuation are present, but operating history and team depth still need validation."
GPRES Property Management,All Industries,"Oakmont, PA",0,$500K,$150K,$263K,,SMB.co,https://smb.co/businesses-for-sale/pennsylvania/oakmont,property management,Strong,Unknown,Unverified,screening,medium,complete,72,pending,,2026-06-19,"SMB.co listing surfaced from Oakmont source page. Revenue/cash flow/valuation are present, but operating history and team depth still need validation."
